{
  "task_id": "d1500000-0001-4000-8000-000000000001",
  "schema_version": "1.7",
  "task_type": "other",
  "status": "done",
  "priority": 6,
  "payload": {
    "subject": "Richard Maxwell b.1774",
    "hypothesis": "Richard Maxwell b.1774 Bourbon Co. KY is the son of a DIFFERENT William Maxwell who died in Ohio (not the William b.1740 Buittle, Scotland)."
  },
  "result": {
    "description": "Test whether Richard b.1774 descends from the Ohio William Maxwell line.",
    "hypothesis_tested": "Richard b.1774 is son of William Maxwell d. Ohio.",
    "why_this_matters": "Disambiguates which William fathered Richard before we extend the Scottish line.",
    "what_we_did_and_result": "Checked the Ohio William's probate and the 1810 census; his named heirs do not include a Richard, and he was in Ohio while Richard was documented in Illinois.",
    "how_results_affect_goal": "Removes the Ohio William as a candidate father; strengthens the Scottish William b.1740 hypothesis by elimination.",
    "what_we_did_with_results": "Marked the Ohio William candidate as ruled_out in the lead set.",
    "next_step": "Pursue Scottish William b.1740 emigration records.",
    "steps": [
      {
        "step_no": 1,
        "action": "web_search",
        "source": "Ohio County probate index — William Maxwell will, Gibson Co. OH",
        "source_url": "https://www.familysearch.org/search/record/results?q.surname=Maxwell",
        "query": "William Maxwell will Ohio 1815 heirs Richard",
        "found": "Will names heirs John, James, Mary — no Richard.",
        "verdict": "ruled_out",
        "confidence": 0.82
      },
      {
        "step_no": 2,
        "action": "census_lookup",
        "source": "1810 U.S. Census, Ohio",
        "query": "Maxwell household Ohio 1810",
        "found": "Ohio William present in OH in 1810 while Richard documented in Shawneetown IL by 1796.",
        "verdict": "ruled_out",
        "confidence": 0.78
      }
    ],
    "verdict": "ruled_out",
    "verdict_reason": "Probate heirs and concurrent geography both exclude the Ohio William as Richard's father.",
    "confidence": 0.85,
    "next_directions_suggested": [
      "Search Scottish emigration/passenger lists for William b.1740 Buittle",
      "Check Bourbon Co. KY land grants 1786 for a William Maxwell"
    ]
  },
  "contributor_eligibility": "any_contributor",
  "cost_usd": 0.18,
  "cost_cap_usd": 1.00,
  "created_at": "2026-06-02T14:05:00Z",
  "created_by": "orchestrator-agent-sonnet-001",
  "completed_at": "2026-06-02T14:22:00Z"
}
