{
  "task_id": "c1000000-0015-4000-8000-000000000015",
  "schema_version": "1.7",
  "task_type": "validate_record",
  "status": "done",
  "priority": 5,
  "payload": {"raw_record_id": "a1b2c3d4-0015-4000-8000-000000000015"},
  "result": {"valid": false, "errors": ["Missing required field: source_url"]},
  "assigned_to": "validator-agent-haiku-001",
  "cost_usd": 0,
  "cost_cap_usd": 0.50,
  "retry_count": 0,
  "max_retries": 3,
  "created_at": "2026-05-01T11:00:00Z",
  "created_by": "orchestrator-agent-sonnet-001",
  "started_at": "2026-05-01T11:00:30Z",
  "completed_at": "2026-05-01T11:00:35Z"
}
