{
  "task_id": "c1000000-0007-4000-8000-000000000007",
  "schema_version": "1.7",
  "task_type": "merge_person",
  "status": "processing",
  "priority": 7,
  "payload": {"candidate_person_ids": ["b1000000-0001-4000-8000-000000000001", "b1000000-0008-4000-8000-000000000008"], "merge_reason": "Name and date overlap above threshold"},
  "assigned_to": "integrator-agent-sonnet-001",
  "cost_cap_usd": 2.00,
  "retry_count": 0,
  "max_retries": 2,
  "created_at": "2026-05-02T09:00:00Z",
  "created_by": "orchestrator-agent-sonnet-001",
  "started_at": "2026-05-02T09:05:00Z"
}
