{
  "task_id": "c1000000-0014-4000-8000-000000000014",
  "schema_version": "1.7",
  "task_type": "merge_person",
  "status": "pending",
  "priority": 6,
  "payload": {"candidate_person_ids": ["b1000000-0001-4000-8000-000000000001", "b1000000-0023-4000-8000-000000000023"]},
  "cost_cap_usd": 2.00,
  "retry_count": 0,
  "max_retries": 2,
  "created_at": "2026-05-05T10:00:00Z",
  "created_by": "orchestrator-agent-sonnet-001",
  "depends_on": [
    "c1000000-0001-4000-8000-000000000001",
    "c1000000-0002-4000-8000-000000000002",
    "c1000000-0003-4000-8000-000000000003",
    "c1000000-0006-4000-8000-000000000006"
  ]
}
