{
  "task_id": "c1000000-0008-4000-8000-000000000008",
  "schema_version": "1.7",
  "task_type": "ingest_to_qdrant",
  "status": "done",
  "priority": 4,
  "payload": {"person_id": "b1000000-0001-4000-8000-000000000001", "collection": "persons_v01"},
  "result": {"qdrant_point_id": "b1000000-0001-4000-8000-000000000001", "vector_dims": 1536},
  "assigned_to": "integrator-agent-sonnet-001",
  "cost_usd": 0.01,
  "cost_cap_usd": 0.50,
  "retry_count": 0,
  "max_retries": 3,
  "created_at": "2026-05-03T10:00:00Z",
  "created_by": "orchestrator-agent-sonnet-001",
  "started_at": "2026-05-03T10:01:00Z",
  "completed_at": "2026-05-03T10:03:00Z"
}
