{
  "task_id": "c1000000-0001-4000-8000-000000000001",
  "schema_version": "1.7",
  "task_type": "extract_record",
  "status": "pending",
  "priority": 5,
  "payload": {
    "source_url": "https://archive.org/details/virginia-births-1778",
    "record_type_hint": "birth_certificate"
  },
  "cost_cap_usd": 0.50,
  "retry_count": 0,
  "max_retries": 3,
  "created_at": "2026-05-01T10:00:00Z",
  "created_by": "orchestrator-agent-sonnet-001"
}
