{
  "task_id": "c1000000-0006-4000-8000-000000000006",
  "schema_version": "1.7",
  "task_type": "validate_record",
  "status": "done",
  "priority": 6,
  "payload": {"raw_record_id": "a1b2c3d4-0001-4000-8000-000000000001", "schema_version": "1.7"},
  "result": {"valid": true, "errors": []},
  "assigned_to": "validator-agent-haiku-001",
  "cost_usd": 0.02,
  "cost_cap_usd": 0.50,
  "retry_count": 0,
  "max_retries": 3,
  "created_at": "2026-05-01T10:30:00Z",
  "created_by": "orchestrator-agent-sonnet-001",
  "started_at": "2026-05-01T10:31:00Z",
  "completed_at": "2026-05-01T10:32:00Z"
}
