{
  "task_id": "c1000000-0098-4000-8000-000000000098",
  "schema_version": "1.7",
  "task_type": "judge_review",
  "status": "pending",
  "priority": 10,
  "payload": {},
  "cost_cap_usd": 0.01,
  "retry_count": 0,
  "max_retries": 0,
  "created_at": "2026-05-04T00:00:00Z",
  "created_by": "judge-agent-sonnet-001"
}
