{
  "task_id": "c1000000-0011-4000-8000-000000000011",
  "schema_version": "1.7",
  "task_type": "judge_review",
  "status": "pending",
  "priority": 10,
  "payload": {"person_id": "b1000000-0003-4000-8000-000000000003", "review_type": "conflict_resolution_required"},
  "cost_cap_usd": 2.00,
  "retry_count": 0,
  "max_retries": 1,
  "created_at": "2026-05-04T14:00:00Z",
  "created_by": "orchestrator-agent-sonnet-001",
  "depends_on": ["c1000000-0004-4000-8000-000000000004"]
}
